Microsoft Windows [Version 10.0.22621.3296]
(c) Microsoft Corporation. All rights reserved.

C:\Users\konik>mysql --version
mysql  Ver 8.0.36 for Win64 on x86_64 (MySQL Community Server - GPL)

C:\Users\konik>mysql -u root -p
Enter password: ****
Welcome to the MySQL monitor.  Commands end with ; or \g.
Your MySQL connection id is 13
Server version: 8.0.36 MySQL Community Server - GPL

Copyright (c) 2000, 2024, Oracle and/or its affiliates.

Oracle is a registered trademark of Oracle Corporation and/or its
affiliates. Other names may be trademarks of their respective
owners.

Type 'help;' or '\h' for help. Type '\c' to clear the current input statement.

mysql> show tables;
ERROR 1046 (3D000): No database selected
mysql> show databse;
ERROR 1064 (42000): You have an error in your SQL syntax; check the manual that corresponds to your MySQL server version for the right syntax to use near 'databse' at line 1
mysql> show databases;
+--------------------+
| Database           |
+--------------------+
| first_db           |
| information_schema |
| my_db              |
| mysql              |
| performance_schema |
| sakila             |
| sys                |
| world              |
+--------------------+
8 rows in set (0.01 sec)

mysql> use my_db;
Database changed
mysql> show tables
    -> ;
+-----------------+
| Tables_in_my_db |
+-----------------+
| students        |
+-----------------+
1 row in set (0.01 sec)

mysql> drop table students;
Query OK, 0 rows affected (0.04 sec)

mysql> create table students(s_id int(4),s_name varchar(40),s_age int(3),primary key(s_id));
Query OK, 0 rows affected, 2 warnings (0.03 sec)

mysql> decs tables;
ERROR 1064 (42000): You have an error in your SQL syntax; check the manual that corresponds to your MySQL server version for the right syntax to use near 'decs tables' at line 1
mysql> desc student;
ERROR 1146 (42S02): Table 'my_db.student' doesn't exist
mysql> desc students;
+--------+-------------+------+-----+---------+-------+
| Field  | Type        | Null | Key | Default | Extra |
+--------+-------------+------+-----+---------+-------+
| s_id   | int         | NO   | PRI | NULL    |       |
| s_name | varchar(40) | YES  |     | NULL    |       |
| s_age  | int         | YES  |     | NULL    |       |
+--------+-------------+------+-----+---------+-------+
3 rows in set (0.01 sec)

mysql> alter table students add column s_result varchar(40);
Query OK, 0 rows affected (0.05 sec)
Records: 0  Duplicates: 0  Warnings: 0

mysql> desc students;
+----------+-------------+------+-----+---------+-------+
| Field    | Type        | Null | Key | Default | Extra |
+----------+-------------+------+-----+---------+-------+
| s_id     | int         | NO   | PRI | NULL    |       |
| s_name   | varchar(40) | YES  |     | NULL    |       |
| s_age    | int         | YES  |     | NULL    |       |
| s_result | varchar(40) | YES  |     | NULL    |       |
+----------+-------------+------+-----+---------+-------+
4 rows in set (0.01 sec)

mysql> alter table students change s_result s_results varchar(30);
Query OK, 0 rows affected (0.09 sec)
Records: 0  Duplicates: 0  Warnings: 0

mysql> desc students;
+-----------+-------------+------+-----+---------+-------+
| Field     | Type        | Null | Key | Default | Extra |
+-----------+-------------+------+-----+---------+-------+
| s_id      | int         | NO   | PRI | NULL    |       |
| s_name    | varchar(40) | YES  |     | NULL    |       |
| s_age     | int         | YES  |     | NULL    |       |
| s_results | varchar(30) | YES  |     | NULL    |       |
+-----------+-------------+------+-----+---------+-------+
4 rows in set (0.00 sec)

mysql> alter table students drop s_results;
Query OK, 0 rows affected (0.04 sec)
Records: 0  Duplicates: 0  Warnings: 0

mysql> desc students;
+--------+-------------+------+-----+---------+-------+
| Field  | Type        | Null | Key | Default | Extra |
+--------+-------------+------+-----+---------+-------+
| s_id   | int         | NO   | PRI | NULL    |       |
| s_name | varchar(40) | YES  |     | NULL    |       |
| s_age  | int         | YES  |     | NULL    |       |
+--------+-------------+------+-----+---------+-------+
3 rows in set (0.00 sec)

mysql> alter table students add column s_result varchar(40);
Query OK, 0 rows affected (0.04 sec)
Records: 0  Duplicates: 0  Warnings: 0

mysql> desc students;
+----------+-------------+------+-----+---------+-------+
| Field    | Type        | Null | Key | Default | Extra |
+----------+-------------+------+-----+---------+-------+
| s_id     | int         | NO   | PRI | NULL    |       |
| s_name   | varchar(40) | YES  |     | NULL    |       |
| s_age    | int         | YES  |     | NULL    |       |
| s_result | varchar(40) | YES  |     | NULL    |       |
+----------+-------------+------+-----+---------+-------+
4 rows in set (0.01 sec)

mysql> insert into students values(1,'Konika',22,'Pass');
Query OK, 1 row affected (0.03 sec)

mysql> insert into students (s_id,s_name,s_result) values (2,'Suraj','Pass');
Query OK, 1 row affected (0.01 sec)

mysql> select * from students;
+------+--------+-------+----------+
| s_id | s_name | s_age | s_result |
+------+--------+-------+----------+
|    1 | Konika |    22 | Pass     |
|    2 | Suraj  |  NULL | Pass     |
+------+--------+-------+----------+
2 rows in set (0.00 sec)

mysql> update students set s_age=24 where s_id=2;
Query OK, 1 row affected (0.02 sec)
Rows matched: 1  Changed: 1  Warnings: 0

mysql> select * from students;
+------+--------+-------+----------+
| s_id | s_name | s_age | s_result |
+------+--------+-------+----------+
|    1 | Konika |    22 | Pass     |
|    2 | Suraj  |    24 | Pass     |
+------+--------+-------+----------+
2 rows in set (0.00 sec)

mysql> insert into table values(3,'Somesh',28,'Fail');
ERROR 1064 (42000): You have an error in your SQL syntax; check the manual that corresponds to your MySQL server version for the right syntax to use near 'table values(3,'Somesh',28,'Fail')' at line 1
mysql> insert into students value(^C
mysql> insert into students values(3,'Somesh',28,'Fail');
Query OK, 1 row affected (0.02 sec)

mysql> select * from students;
+------+--------+-------+----------+
| s_id | s_name | s_age | s_result |
+------+--------+-------+----------+
|    1 | Konika |    22 | Pass     |
|    2 | Suraj  |    24 | Pass     |
|    3 | Somesh |    28 | Fail     |
+------+--------+-------+----------+
3 rows in set (0.00 sec)

mysql> delete from students s_age where s_id=1;
Query OK, 1 row affected (0.02 sec)

mysql> select * from students;
+------+--------+-------+----------+
| s_id | s_name | s_age | s_result |
+------+--------+-------+----------+
|    2 | Suraj  |    24 | Pass     |
|    3 | Somesh |    28 | Fail     |
+------+--------+-------+----------+
2 rows in set (0.00 sec)

mysql> insert into students values(1,'Konika',22,'Pass');
Query OK, 1 row affected (0.02 sec)

mysql> desc students;
+----------+-------------+------+-----+---------+-------+
| Field    | Type        | Null | Key | Default | Extra |
+----------+-------------+------+-----+---------+-------+
| s_id     | int         | NO   | PRI | NULL    |       |
| s_name   | varchar(40) | YES  |     | NULL    |       |
| s_age    | int         | YES  |     | NULL    |       |
| s_result | varchar(40) | YES  |     | NULL    |       |
+----------+-------------+------+-----+---------+-------+
4 rows in set (0.00 sec)

mysql> select * from students;
+------+--------+-------+----------+
| s_id | s_name | s_age | s_result |
+------+--------+-------+----------+
|    1 | Konika |    22 | Pass     |
|    2 | Suraj  |    24 | Pass     |
|    3 | Somesh |    28 | Fail     |
+------+--------+-------+----------+
3 rows in set (0.00 sec)

mysql> delete from students where s_age=28;
Query OK, 1 row affected (0.02 sec)

mysql> select * from students;
+------+--------+-------+----------+
| s_id | s_name | s_age | s_result |
+------+--------+-------+----------+
|    1 | Konika |    22 | Pass     |
|    2 | Suraj  |    24 | Pass     |
+------+--------+-------+----------+
2 rows in set (0.00 sec)

mysql> insert into students values(3,'Somesh',28,'Fail');
Query OK, 1 row affected (0.02 sec)

mysql> select * from students;
+------+--------+-------+----------+
| s_id | s_name | s_age | s_result |
+------+--------+-------+----------+
|    1 | Konika |    22 | Pass     |
|    2 | Suraj  |    24 | Pass     |
|    3 | Somesh |    28 | Fail     |
+------+--------+-------+----------+
3 rows in set (0.00 sec)

mysql> update students set s_age=null where s_id=3;
Query OK, 1 row affected (0.02 sec)
Rows matched: 1  Changed: 1  Warnings: 0

mysql> select * from students;
+------+--------+-------+----------+
| s_id | s_name | s_age | s_result |
+------+--------+-------+----------+
|    1 | Konika |    22 | Pass     |
|    2 | Suraj  |    24 | Pass     |
|    3 | Somesh |  NULL | Fail     |
+------+--------+-------+----------+
3 rows in set (0.00 sec)

mysql> update students set s_age=28 where s_result='Fails';
Query OK, 0 rows affected (0.00 sec)
Rows matched: 0  Changed: 0  Warnings: 0

mysql> select * from students;
+------+--------+-------+----------+
| s_id | s_name | s_age | s_result |
+------+--------+-------+----------+
|    1 | Konika |    22 | Pass     |
|    2 | Suraj  |    24 | Pass     |
|    3 | Somesh |  NULL | Fail     |
+------+--------+-------+----------+
3 rows in set (0.00 sec)

mysql> update students set s_age=28 where s_id=3;
Query OK, 1 row affected (0.02 sec)
Rows matched: 1  Changed: 1  Warnings: 0

mysql> select * from students;
+------+--------+-------+----------+
| s_id | s_name | s_age | s_result |
+------+--------+-------+----------+
|    1 | Konika |    22 | Pass     |
|    2 | Suraj  |    24 | Pass     |
|    3 | Somesh |    28 | Fail     |
+------+--------+-------+----------+
3 rows in set (0.00 sec)

mysql> create table teachers (t_id int(5),t_name varchar(10));
Query OK, 0 rows affected, 1 warning (0.05 sec)

mysql> show tables;
+-----------------+
| Tables_in_my_db |
+-----------------+
| students        |
| teachers        |
+-----------------+
2 rows in set (0.01 sec)

mysql> select * from teachers;
Empty set (0.00 sec)

mysql> desc teachers;
+--------+-------------+------+-----+---------+-------+
| Field  | Type        | Null | Key | Default | Extra |
+--------+-------------+------+-----+---------+-------+
| t_id   | int         | YES  |     | NULL    |       |
| t_name | varchar(10) | YES  |     | NULL    |       |
+--------+-------------+------+-----+---------+-------+
2 rows in set (0.01 sec)

mysql> insert into teachers (t_id,t_name) values (1,'somesh');
Query OK, 1 row affected (0.02 sec)

mysql> insert into teachers (t_id,t_name) values (2,'mahendra');
Query OK, 1 row affected (0.03 sec)

mysql> desc teachers;
+--------+-------------+------+-----+---------+-------+
| Field  | Type        | Null | Key | Default | Extra |
+--------+-------------+------+-----+---------+-------+
| t_id   | int         | YES  |     | NULL    |       |
| t_name | varchar(10) | YES  |     | NULL    |       |
+--------+-------------+------+-----+---------+-------+
2 rows in set (0.01 sec)

mysql> select * from teachers;
+------+----------+
| t_id | t_name   |
+------+----------+
|    1 | somesh   |
|    2 | mahendra |
+------+----------+
2 rows in set (0.00 sec)

mysql> truncate teachers;
Query OK, 0 rows affected (0.07 sec)

mysql> select * from teachers;
Empty set (0.00 sec)

mysql> desc teachers;
+--------+-------------+------+-----+---------+-------+
| Field  | Type        | Null | Key | Default | Extra |
+--------+-------------+------+-----+---------+-------+
| t_id   | int         | YES  |     | NULL    |       |
| t_name | varchar(10) | YES  |     | NULL    |       |
+--------+-------------+------+-----+---------+-------+
2 rows in set (0.00 sec)

mysql> insert into teachers (t_id,t_name) values (2,'mahendra');
Query OK, 1 row affected (0.02 sec)

mysql> insert into teachers (t_id,t_name) values (1,'somesh');
Query OK, 1 row affected (0.03 sec)

mysql> truncate teachers with partitions(1);
ERROR 1064 (42000): You have an error in your SQL syntax; check the manual that corresponds to your MySQL server version for the right syntax to use near 'with partitions(1)' at line 1
mysql> truncate table teachers with partitions(1);
ERROR 1064 (42000): You have an error in your SQL syntax; check the manual that corresponds to your MySQL server version for the right syntax to use near 'with partitions(1)' at line 1
mysql> alter table teachers add column t_age int(3);
Query OK, 0 rows affected, 1 warning (0.05 sec)
Records: 0  Duplicates: 0  Warnings: 1

mysql> select * from teachers;
+------+----------+-------+
| t_id | t_name   | t_age |
+------+----------+-------+
|    2 | mahendra |  NULL |
|    1 | somesh   |  NULL |
+------+----------+-------+
2 rows in set (0.00 sec)

mysql> update teachers set t_age=28 where t_id=2;
Query OK, 1 row affected (0.03 sec)
Rows matched: 1  Changed: 1  Warnings: 0

mysql> select * from teachers;
+------+----------+-------+
| t_id | t_name   | t_age |
+------+----------+-------+
|    2 | mahendra |    28 |
|    1 | somesh   |  NULL |
+------+----------+-------+
2 rows in set (0.00 sec)

mysql> update teachers set t_age=35 where t_id=1;
Query OK, 1 row affected (0.03 sec)
Rows matched: 1  Changed: 1  Warnings: 0

mysql> select * from teachers;
+------+----------+-------+
| t_id | t_name   | t_age |
+------+----------+-------+
|    2 | mahendra |    28 |
|    1 | somesh   |    35 |
+------+----------+-------+
2 rows in set (0.00 sec)

mysql> truncate table teachers with partitions(1,3);
ERROR 1064 (42000): You have an error in your SQL syntax; check the manual that corresponds to your MySQL server version for the right syntax to use near 'with partitions(1,3)' at line 1
mysql> TRUNCATE TABLE Student
    -> ^C
mysql> truncate table teachers WITH PARTITIONS (1, 3);
ERROR 1064 (42000): You have an error in your SQL syntax; check the manual that corresponds to your MySQL server version for the right syntax to use near 'WITH PARTITIONS (1, 3)' at line 1
mysql> show tables;
+-----------------+
| Tables_in_my_db |
+-----------------+
| students        |
| teachers        |
+-----------------+
2 rows in set (0.01 sec)

mysql> select * from from students;
ERROR 1064 (42000): You have an error in your SQL syntax; check the manual that corresponds to your MySQL server version for the right syntax to use near 'from students' at line 1
mysql> select * from students;
+------+--------+-------+----------+
| s_id | s_name | s_age | s_result |
+------+--------+-------+----------+
|    1 | Konika |    22 | Pass     |
|    2 | Suraj  |    24 | Pass     |
|    3 | Somesh |    28 | Fail     |
+------+--------+-------+----------+
3 rows in set (0.00 sec)

mysql> insert into table values(3,'sk',32,'Pass');
ERROR 1064 (42000): You have an error in your SQL syntax; check the manual that corresponds to your MySQL server version for the right syntax to use near 'table values(3,'sk',32,'Pass')' at line 1
mysql> insert into table values(4,'sk',32,'Fail');
ERROR 1064 (42000): You have an error in your SQL syntax; check the manual that corresponds to your MySQL server version for the right syntax to use near 'table values(4,'sk',32,'Fail')' at line 1
mysql> insert into students values(3,'sk',32,'Pass');
ERROR 1062 (23000): Duplicate entry '3' for key 'students.PRIMARY'
mysql> insert into students values(4,'sk',32,'Fail');
Query OK, 1 row affected (0.03 sec)

mysql> select * from students;
+------+--------+-------+----------+
| s_id | s_name | s_age | s_result |
+------+--------+-------+----------+
|    1 | Konika |    22 | Pass     |
|    2 | Suraj  |    24 | Pass     |
|    3 | Somesh |    28 | Fail     |
|    4 | sk     |    32 | Fail     |
+------+--------+-------+----------+
4 rows in set (0.00 sec)

mysql> insert into students(s_name,s_age) values('Koni',45);
ERROR 1364 (HY000): Field 's_id' doesn't have a default value
mysql> select * from students;
+------+--------+-------+----------+
| s_id | s_name | s_age | s_result |
+------+--------+-------+----------+
|    1 | Konika |    22 | Pass     |
|    2 | Suraj  |    24 | Pass     |
|    3 | Somesh |    28 | Fail     |
|    4 | sk     |    32 | Fail     |
+------+--------+-------+----------+
4 rows in set (0.00 sec)

mysql>
